{
  "$schema": "http://json-schema.org/draft-04/schema#",
  "type": "object",
  "properties": {
    "network-devices": { "$ref": "networkdevices.json" },
    "endpoints": { "$ref": "endpoints.json" },
    "network-links": { "$ref": "networklinks.json" },
    "endpoint-links": { "$ref": "endpointlinks.json" }
  },
  "required": [
    "network-devices",
    "endpoints",
    "network-links",
    "endpoint-links"
  ]
}
